<?xml version="1.0" encoding="UTF-8"?>
<TableActiveNews xmlns:xsi="http://www.w3.org/2001/XMLSchema-instance" xsi:noNamespaceSchemaLocation="databaseDefinition/ActiveNews.xsd" IDLastNews="28">
	
	<ActiveNews>
	<ID>28</ID>
	<Title>Incontro ERASMUS Informatica</Title>
	<Date>2012-02-14</Date>
	<Time>13:02:00</Time>
	<Text>A tutti gli studenti di Informatica interessati al programma ERASMUS.

Siete invitati a presentarvi Martedì 21 febbraio alle ore 5pm in aula riunioni al 4 piano di Torre Archimede al fine di:

1) raccogliere gli interessi degli studenti in merito alle sedi preferite, in maniera tale da evidenziare e possibilmente risolvere eventuali inefficienze (e.g. evitare che tutti si concentrino su una sede, diminuendo per molti la probabilità di successo).

2) fare un test informale di inglese (di cui si terrà eventualmente conto in fase di selezione delle domande), necessario ad evidenziare necessità di miglioramento della lingua prima della partenza.
Per Aix-Marseille il test sarà di lingua francese.

I docenti di Informatica responsabili dei flussi ERASMUS.</Text>
	<Publisher>Mauro Conti</Publisher>
	<Type>G</Type>
	<Archive>F</Archive>
	<ExpirationDate>2012-02-22</ExpirationDate></ActiveNews></TableActiveNews>
